{
  "schema": "octopus.local_package",
  "schema_version": 1,
  "id": "world_mcp_notion",
  "version": "1.0.0",
  "product_kind": "application",
  "product_id": "world_mcp_notion",
  "release_status": "optional",
  "display": {
    "name": "Notion",
    "description": "Find and work with pages in Notion.",
    "developer": "Octopus",
    "category": "plugin",
    "icon": "files"
  },
  "members": [
    {
      "registry_kind": "interface",
      "owner": "world_mcp_notion",
      "primary": true
    },
    {
      "registry_kind": "artifact",
      "owner": "artifact-application-mcp-notion-context"
    }
  ]
}
