{
  "schema": "octopus.local_package",
  "schema_version": 1,
  "id": "world_provider_opencode_go",
  "version": "1.0.0",
  "product_kind": "application",
  "product_id": "world_provider_opencode_go",
  "release_status": "optional",
  "display": {
    "name": "OpenCode Go",
    "description": "Open coding models through an OpenCode Go subscription key.",
    "developer": "OpenCode",
    "category": "provider",
    "icon": "sparkles"
  },
  "members": [
    {
      "registry_kind": "interface",
      "owner": "world_provider_opencode_go",
      "primary": true,
      "configuration": [
        {
          "path": "interface.json",
          "fields": [
            {
              "pointer": "/interface_driver_config/private_config/model",
              "schema": {
                "type": "string",
                "minLength": 1
              }
            },
            {
              "pointer": "/interface_driver_config/private_config/reasoning_effort",
              "schema": {
                "type": "string",
                "enum": [
                  "minimal",
                  "low",
                  "medium",
                  "high",
                  "xhigh",
                  "max"
                ]
              }
            }
          ]
        }
      ]
    }
  ],
  "required_packages": [
    "world_provider_codex"
  ]
}
