{
  "schema": "octopus.local_package",
  "schema_version": 1,
  "id": "driver.desktop_session",
  "version": "1.1.0",
  "product_kind": "driver",
  "product_id": "desktop_session",
  "release_status": "optional",
  "display": {
    "name": "Computer Use",
    "description": "Computer Use tools for Home and ordinary tasks, with a reusable Computer Use Agent preset.",
    "developer": "Octopus",
    "category": "worker_environment",
    "icon": "desktop"
  },
  "members": [
    {
      "registry_kind": "worker_environment_kind",
      "owner": "desktop_session",
      "primary": true
    },
    {
      "registry_kind": "interface",
      "owner": "system_gui",
      "configuration": [{"path":"life.json","fields":[{"pointer":"/processes/0/authority/sandbox_mode","schema":{"type":"string","enum":["enforced","disabled"]}},{"pointer":"/processes/1/authority/sandbox_mode","schema":{"type":"string","enum":["enforced","disabled"]}}]},{"path":"interface.json","fields":[{"pointer":"/interface_driver_config","schema":{"type":"object","required":["private_config"],"properties":{"private_config":{"type":"object","required":["context_artifact_bindings"],"properties":{"context_artifact_bindings":{"type":"array","items":{"type":"object","required":["id"],"properties":{"id":{"type":"string","minLength":1,"pattern":"^[^/\\\\\\u0000]+$"}},"additionalProperties":false},"uniqueItems":true}},"additionalProperties":false}},"additionalProperties":false}}]},{"path":"desktop.json","fields":[{"pointer":"/host/native_sandbox_mode","schema":{"type":"string","enum":["enforced","disabled"]}}]}]
    },
    {
      "registry_kind": "tool",
      "owner": "gui.control",
      "configuration": [{"path":"tool.json","fields":[{"pointer":"/process/authority/sandbox_mode","schema":{"type":"string","enum":["enforced","disabled"]}}]}]
    },
    {
      "registry_kind": "tool",
      "owner": "gui.cancel",
      "configuration": [{"path":"tool.json","fields":[{"pointer":"/process/authority/sandbox_mode","schema":{"type":"string","enum":["enforced","disabled"]}}]}]
    },
    {
      "registry_kind": "tool",
      "owner": "gui.status",
      "configuration": [{"path":"tool.json","fields":[{"pointer":"/process/authority/sandbox_mode","schema":{"type":"string","enum":["enforced","disabled"]}}]}]
    },
    {
      "registry_kind": "tool",
      "owner": "gui.app_state",
      "configuration": [{"path":"tool.json","fields":[{"pointer":"/process/authority/sandbox_mode","schema":{"type":"string","enum":["enforced","disabled"]}}]}]
    },
    {
      "registry_kind": "tool",
      "owner": "gui.app_resume",
      "configuration": [{"path":"tool.json","fields":[{"pointer":"/process/authority/sandbox_mode","schema":{"type":"string","enum":["enforced","disabled"]}}]}]
    },
    {
      "registry_kind": "tool",
      "owner": "gui.apps",
      "configuration": [{"path":"tool.json","fields":[{"pointer":"/process/authority/sandbox_mode","schema":{"type":"string","enum":["enforced","disabled"]}}]}]
    },
    {
      "registry_kind": "tool",
      "owner": "gui.app_click",
      "configuration": [{"path":"tool.json","fields":[{"pointer":"/process/authority/sandbox_mode","schema":{"type":"string","enum":["enforced","disabled"]}}]}]
    },
    {
      "registry_kind": "tool",
      "owner": "gui.app_move",
      "configuration": [{"path":"tool.json","fields":[{"pointer":"/process/authority/sandbox_mode","schema":{"type":"string","enum":["enforced","disabled"]}}]}]
    },
    {
      "registry_kind": "tool",
      "owner": "gui.app_drag",
      "configuration": [{"path":"tool.json","fields":[{"pointer":"/process/authority/sandbox_mode","schema":{"type":"string","enum":["enforced","disabled"]}}]}]
    },
    {
      "registry_kind": "tool",
      "owner": "gui.app_scroll",
      "configuration": [{"path":"tool.json","fields":[{"pointer":"/process/authority/sandbox_mode","schema":{"type":"string","enum":["enforced","disabled"]}}]}]
    },
    {
      "registry_kind": "tool",
      "owner": "gui.app_key",
      "configuration": [{"path":"tool.json","fields":[{"pointer":"/process/authority/sandbox_mode","schema":{"type":"string","enum":["enforced","disabled"]}}]}]
    },
    {
      "registry_kind": "tool",
      "owner": "gui.app_type",
      "configuration": [{"path":"tool.json","fields":[{"pointer":"/process/authority/sandbox_mode","schema":{"type":"string","enum":["enforced","disabled"]}}]}]
    },
    {
      "registry_kind": "tool",
      "owner": "gui.app_set_value",
      "configuration": [{"path":"tool.json","fields":[{"pointer":"/process/authority/sandbox_mode","schema":{"type":"string","enum":["enforced","disabled"]}}]}]
    },
    {
      "registry_kind": "tool",
      "owner": "gui.app_select_text",
      "configuration": [{"path":"tool.json","fields":[{"pointer":"/process/authority/sandbox_mode","schema":{"type":"string","enum":["enforced","disabled"]}}]}]
    },
    {
      "registry_kind": "tool",
      "owner": "gui.app_secondary_action",
      "configuration": [{"path":"tool.json","fields":[{"pointer":"/process/authority/sandbox_mode","schema":{"type":"string","enum":["enforced","disabled"]}}]}]
    },
    {
      "registry_kind": "tool",
      "owner": "gui.app_paste",
      "configuration": [{"path":"tool.json","fields":[{"pointer":"/process/authority/sandbox_mode","schema":{"type":"string","enum":["enforced","disabled"]}}]}]
    },
    {
      "registry_kind": "tool",
      "owner": "gui.observe",
      "configuration": [{"path":"tool.json","fields":[{"pointer":"/process/authority/sandbox_mode","schema":{"type":"string","enum":["enforced","disabled"]}}]}]
    },
    {
      "registry_kind": "tool",
      "owner": "gui.screenshot",
      "configuration": [{"path":"tool.json","fields":[{"pointer":"/process/authority/sandbox_mode","schema":{"type":"string","enum":["enforced","disabled"]}}]}]
    },
    {
      "registry_kind": "tool",
      "owner": "gui.click",
      "configuration": [{"path":"tool.json","fields":[{"pointer":"/process/authority/sandbox_mode","schema":{"type":"string","enum":["enforced","disabled"]}}]}]
    },
    {
      "registry_kind": "tool",
      "owner": "gui.move",
      "configuration": [{"path":"tool.json","fields":[{"pointer":"/process/authority/sandbox_mode","schema":{"type":"string","enum":["enforced","disabled"]}}]}]
    },
    {
      "registry_kind": "tool",
      "owner": "gui.type",
      "configuration": [{"path":"tool.json","fields":[{"pointer":"/process/authority/sandbox_mode","schema":{"type":"string","enum":["enforced","disabled"]}}]}]
    },
    {
      "registry_kind": "tool",
      "owner": "gui.key",
      "configuration": [{"path":"tool.json","fields":[{"pointer":"/process/authority/sandbox_mode","schema":{"type":"string","enum":["enforced","disabled"]}}]}]
    },
    {
      "registry_kind": "tool",
      "owner": "gui.scroll",
      "configuration": [{"path":"tool.json","fields":[{"pointer":"/process/authority/sandbox_mode","schema":{"type":"string","enum":["enforced","disabled"]}}]}]
    },
    {
      "registry_kind": "tool",
      "owner": "gui.drag",
      "configuration": [{"path":"tool.json","fields":[{"pointer":"/process/authority/sandbox_mode","schema":{"type":"string","enum":["enforced","disabled"]}}]}]
    },
    {
      "registry_kind": "interface",
      "owner": "system_worker_computer_use"
    },
    {
      "registry_kind": "artifact",
      "owner": "artifact-worker-role-computer-use"
    },
    {
      "registry_kind": "artifact",
      "owner": "artifact-secret-handle-flow"
    },
    {
      "registry_kind": "mark",
      "owner": "ocr.text.contains"
    },
    {
      "registry_kind": "mark",
      "owner": "task.summary.received"
    }
  ],
  "required_packages": [
    "artifact.codex_context",
    "driver.system_room",
    "driver.audio_device_session",
    "driver.code_mode",
    "driver.browser_session"
  ]
}
